{
  "$schema": "https://json-schema.org/draft/2020-12/schema",
  "$id": "urn:testlane:schema:feature-workflow:v1",
  "title": "Testlane feature acceptance workflow manifest",
  "description": "A strict, secret-free manifest for one bounded two-role feature acceptance run.",
  "type": "object",
  "additionalProperties": false,
  "required": ["schemaVersion", "kind", "id", "target", "roles", "checks", "record", "timeoutMs", "cleanupTimeoutMs"],
  "properties": {
    "schemaVersion": {"const": 1},
    "kind": {"const": "feature-acceptance"},
    "id": {"$ref": "#/$defs/id"},
    "target": {
      "type": "object",
      "additionalProperties": false,
      "required": ["origin", "environment", "buildId"],
      "properties": {
        "origin": {"$ref": "#/$defs/origin"},
        "environment": {"enum": ["sandbox", "testing"]},
        "buildId": {"$ref": "#/$defs/id"}
      }
    },
    "roles": {
      "type": "object",
      "additionalProperties": false,
      "required": ["writer", "reader"],
      "properties": {
        "writer": {"$ref": "#/$defs/role"},
        "reader": {"$ref": "#/$defs/role"}
      }
    },
    "checks": {
      "type": "object",
      "additionalProperties": false,
      "required": ["readinessPath", "identityPath", "environmentPath"],
      "properties": {
        "readinessPath": {"$ref": "#/$defs/path"},
        "identityPath": {"$ref": "#/$defs/path"},
        "environmentPath": {"$ref": "#/$defs/path"}
      }
    },
    "record": {
      "type": "object",
      "additionalProperties": false,
      "required": ["collectionPath", "createPagePath", "form"],
      "properties": {
        "collectionPath": {"allOf": [{"$ref": "#/$defs/path"}, {"type": "string", "pattern": "[^/]$"}]},
        "createPagePath": {"$ref": "#/$defs/path"},
        "form": {
          "type": "object",
          "additionalProperties": false,
          "required": ["idLabel", "titleLabel", "submitLabel", "createdText"],
          "properties": {
            "idLabel": {"$ref": "#/$defs/text"},
            "titleLabel": {"$ref": "#/$defs/text"},
            "submitLabel": {"$ref": "#/$defs/text"},
            "createdText": {"$ref": "#/$defs/text"}
          }
        }
      }
    },
    "timeoutMs": {"type": "integer", "minimum": 1000, "maximum": 300000},
    "cleanupTimeoutMs": {"type": "integer", "minimum": 1000, "maximum": 60000}
  },
  "$defs": {
    "id": {"type": "string", "minLength": 1, "maxLength": 128, "pattern": "^[A-Za-z0-9][A-Za-z0-9._:-]*$"},
    "profile": {"type": "string", "minLength": 1, "maxLength": 128, "pattern": "^[a-z0-9][a-z0-9._-]*(:[a-z0-9][a-z0-9._-]*)*$"},
    "origin": {"type": "string", "minLength": 1, "maxLength": 256, "pattern": "^https://(?![^/?#]*(?:^|\\.)(?:prod|production|live)(?:[.:/]|$))[^/?#@\\s]+/?$|^http://(?:localhost|127\\.0\\.0\\.1|\\[?::1\\]?)(?::[0-9]{1,5})?/?$"},
    "path": {"type": "string", "minLength": 1, "maxLength": 512, "pattern": "^/(?!/)(?!.*://)(?!.*(?:^|/)\\.{1,2}(?:/|$))[^%?#\\\\\\s\\u0000-\\u001f\\u007f]*$"},
    "text": {"type": "string", "minLength": 1, "maxLength": 256, "pattern": "^(?!\\s)(?!.*\\s$)[^\\u0000-\\u001f\\u007f]+$"},
    "role": {
      "type": "object",
      "additionalProperties": false,
      "required": ["profile", "email", "role"],
      "properties": {
        "profile": {"$ref": "#/$defs/profile"},
        "email": {"type": "string", "format": "email", "maxLength": 320},
        "role": {"$ref": "#/$defs/text"}
      }
    }
  }
}
